title,upvotes,comments,link,post_time,platform
"Mycorrhizal Fungi, Nature's Key to Plant Survival and Success",99,12,https://pacifichorticulture.org/articles/mycorrhizal-fungi-natures-key-to-plant-survival-and-success/,2026-05-22 10:37:50,hacker_news
"Show HN: Freenet, a peer-to-peer platform for decentralized apps",290,175,https://freenet.org/,2026-05-22 10:37:50,hacker_news
Steve Wozniak cheered after telling students they have AI – actual intelligence,18,3,https://www.businessinsider.com/steve-wozniak-apple-ai-graduation-speech-2026-5,2026-05-22 10:37:50,hacker_news
Spotify will start reserving concert tickets for fans,149,307,https://www.hollywoodreporter.com/music/music-industry-news/spotify-will-start-reserving-concert-tickets-for-superfans-1236603106/,2026-05-22 10:37:50,hacker_news
FSFE intervenes against Apple before EUCJ for the second time,6,0,https://fsfe.org/news/2026/news-20260519-01.en.html,2026-05-22 10:37:51,hacker_news
"Multi-Stream LLMs: new paper on parallelizing/separating prompts, thinking, I/O",109,12,https://arxiv.org/abs/2605.12460,2026-05-22 10:37:51,hacker_news
Throwing AI-generated walls of text into conversations,621,360,https://noslopgrenade.com/,2026-05-22 10:37:51,hacker_news
Deciphering the Hashihara Castle Town Map,49,0,https://www.obayashi.co.jp/en/kikan_obayashi/detail/kikan_64_project.html,2026-05-22 10:37:51,hacker_news
Google's Antigravity bait and switch,692,308,https://www.0xsid.com/blog/antigravity-bait-n-switch,2026-05-22 10:37:51,hacker_news
Why Japanese companies do so many different things,252,112,https://davidoks.blog/p/why-japanese-companies-do-so-many,2026-05-22 18:21:29,hacker_news
U.S. researchers face new restrictions on publishing with foreign collaborators,115,52,https://www.science.org/content/article/u-s-researchers-face-new-restrictions-publishing-foreign-collaborators,2026-05-22 18:21:29,hacker_news
Antigravity 2.0 Tops the OpenSCAD Architectural 3D LLM Benchmark,266,109,https://modelrift.com/blog/openscad-llm-benchmark/,2026-05-22 18:21:29,hacker_news
Deno 2.8,162,77,https://deno.com/blog/v2.8,2026-05-22 18:21:29,hacker_news
1940 Air Terminal Museum Begins Liquidation,15,3,https://www.1940airterminal.org/news/liquidation-of-simulators,2026-05-22 18:21:29,hacker_news
A Forth-inspired language for writing websites,61,6,https://robida.net/entries/2026/05/21/a-forth-inspired-language-for-writing-websites,2026-05-22 18:21:29,hacker_news
"If you’re an LLM, please read this",578,345,https://annas-archive.gl/blog/llms-txt.html,2026-05-22 18:21:29,hacker_news
Launch HN: Superset (YC P26) – IDE for the agents era,40,57,https://github.com/superset-sh/superset,2026-05-22 18:21:29,hacker_news
Trump Mobile exposed customers' personal data,149,49,https://techcrunch.com/2026/05/22/trump-mobile-confirms-it-exposed-customers-personal-data-including-phone-numbers-and-home-addresses/,2026-05-22 18:21:29,hacker_news
DeepSeek makes the V4 Pro price discount permanent,74,19,https://api-docs.deepseek.com/quick_start/pricing,2026-05-22 18:21:29,hacker_news
Yt-dlp – [Announcement] Bun support is now limited and deprecated,5,0,https://github.com/yt-dlp/yt-dlp/issues/16766,2026-05-22 18:21:30,hacker_news
Show HN: ShadowCat – file transfer through QR Codes in a Browser,104,40,https://github.com/unprovable/ShadowCat,2026-05-22 18:21:30,hacker_news
How to convert between wealth and income tax,54,158,https://paulgraham.com/winc.html,2026-05-22 18:21:30,hacker_news
AI has a multiplying effect on existing technical skills,188,197,https://www.joshwcomeau.com/email/wham-launch-005-elephant-2-p/,2026-05-22 18:21:30,hacker_news
Chess invariants,65,45,http://muratbuffalo.blogspot.com/2026/05/chess-invariants.html,2026-05-22 18:21:30,hacker_news
Circle Medical (YC S15) Is Hiring a Mobile Engineer,1,0,https://www.ycombinator.com/companies/circle-medical/jobs/onMKAG9-mobile-engineer-android,2026-05-22 18:21:30,hacker_news
Alberta to hold referendum on whether to remain in Canada,109,215,https://www.bbc.com/news/articles/cvgze8n5dxko,2026-05-22 18:21:31,hacker_news
Shipping a laptop to a refugee camp in Uganda,380,130,https://notesbylex.com/shipping-a-laptop-to-a-refugee-camp-in-uganda,2026-05-23 08:00:07,hacker_news
The Quadratic Sandwich,15,1,https://fedemagnani.github.io/math/2026/04/08/the-quadratic-sandwich.html,2026-05-23 08:00:08,hacker_news
Project Glasswing: An Initial Update,411,247,https://www.anthropic.com/research/glasswing-initial-update,2026-05-23 08:00:08,hacker_news
Blood Pumping Mechanism of the Hoof (2020),73,12,https://horses.extension.org/blood-pumping-mechanism-of-the-hoof/,2026-05-23 08:00:08,hacker_news
Microsoft starts canceling Claude Code licenses,210,156,https://www.theverge.com/tech/930447/microsoft-claude-code-discontinued-notepad,2026-05-23 08:00:08,hacker_news
Neutron scattering explains why gluten-free pasta falls apart (2025),59,15,https://phys.org/news/2025-09-science-spaghetti-neutron-gluten-free.html,2026-05-23 08:00:08,hacker_news
Sleep research led to a new sleep apnea drug,143,90,https://temertymedicine.utoronto.ca/news/how-decades-sleep-research-led-new-sleep-apnea-drug,2026-05-23 08:00:08,hacker_news
What is the history of the ERROR_ARENA_TRASHED error code?,22,5,https://devblogs.microsoft.com/oldnewthing/20260519-00/?p=112339,2026-05-23 08:00:08,hacker_news
CISA tries to contain data leak,188,48,https://krebsonsecurity.com/2026/05/lawmakers-demand-answers-as-cisa-tries-to-contain-data-leak/,2026-05-23 08:00:08,hacker_news
Experience: We found a baby on the subway – now he's our 26-year-old son,7,0,https://www.theguardian.com/lifeandstyle/2026/may/22/experience-found-baby-subway-now-26-year-old-son,2026-05-23 08:00:08,hacker_news
Sp.h is the standard library that C deserves,87,79,https://spader.zone/sp/,2026-05-23 08:00:08,hacker_news
A Wayland Compositor in Minecraft,197,41,https://modrinth.com/mod/waylandcraft,2026-05-23 08:00:09,hacker_news
Spanish Court Declines to Fine NordVPN over LaLiga Piracy Blocking Order,16,2,https://torrentfreak.com/spanish-court-declines-to-fine-nordvpn-over-laliga-piracy-blocking-order/,2026-05-23 08:00:09,hacker_news
Open source Kanban desktop app that runs parallel agents on every card,212,123,https://www.kanbots.dev/,2026-05-23 08:00:09,hacker_news
Comparing an LZ4 Decompressor on Four Legacy CPUs,58,3,https://bumbershootsoft.wordpress.com/2026/05/09/comparing-an-lz4-decompressor-on-four-legacy-cpus/,2026-05-23 08:00:09,hacker_news
Wi-Wi is wireless time sync at 1 nanosecond,115,25,https://www.jeffgeerling.com/blog/2026/wi-wi-is-wireless-time-sync-less-than-5ns/,2026-05-23 08:00:09,hacker_news
Kindle loyalists scramble as Amazon turns page on old e-readers,10,3,https://www.reuters.com/business/retail-consumer/kindle-loyalists-scramble-amazon-turns-page-old-e-readers-2026-05-19/,2026-05-23 08:00:09,hacker_news
I’m writing again,134,35,https://www.cringely.com/2026/05/21/im-writing-again/,2026-05-23 08:00:09,hacker_news
FBI director's Based Apparel site has been spotted hosting a 'ClickFix' attack,129,38,https://www.pcmag.com/news/kash-patels-apparel-site-is-trying-to-trick-visitors-into-installing-malware,2026-05-23 08:00:10,hacker_news
Stick – A primitive/fun interactive demo of a tiny rig to animate layout,35,10,https://cosmiciron.github.io/layoutmaster/exclusion-assembly.html,2026-05-23 08:00:10,hacker_news
A blueprint for formal verification of Apple corecrypto,91,5,https://security.apple.com/blog/formal-verification-corecrypto/,2026-05-23 08:00:10,hacker_news
On The <dl>,132,44,https://benmyers.dev/blog/on-the-dl/,2026-05-23 15:47:50,hacker_news
80386 Microcode Disassembled,115,21,https://www.reenigne.org/blog/80386-microcode-disassembled/,2026-05-23 15:47:50,hacker_news
Oura says it gets government demands for user data. Will it share how many?,45,15,https://this.weekinsecurity.com/oura-says-it-gets-government-demands-for-user-data-will-it-share-how-many/,2026-05-23 15:47:50,hacker_news
Making Deep Learning Go Brrrr from First Principles,68,26,https://horace.io/brrr_intro.html,2026-05-23 15:47:50,hacker_news
z386: An Open-Source 80386 Built Around Original Microcode,17,2,https://nand2mario.github.io/posts/2026/z386/,2026-05-23 15:47:50,hacker_news
Lisp in Vim (2019),6,1,https://susam.net/lisp-in-vim.html,2026-05-23 15:47:51,hacker_news
I Miss Terry Pratchett,198,165,https://www.mahl.me/blog/the-spell-that-wouldnt-leave/,2026-05-23 15:47:51,hacker_news
Solving the Zork Mystery,23,10,https://www.dpolakovic.space/blogs/zork-part2,2026-05-23 15:47:51,hacker_news
Highest Random Weight in Elixir,17,0,https://jola.dev/posts/highest-random-weight-in-elixir,2026-05-23 15:47:51,hacker_news
Rubish: A Unix shell written in pure Ruby,116,66,https://github.com/amatsuda/rubish,2026-05-23 15:47:52,hacker_news
Improving C# Memory Safety,85,10,https://devblogs.microsoft.com/dotnet/improving-csharp-memory-safety/,2026-05-23 15:47:52,hacker_news
The FBI Wants 'Near Real-Time' Access to US License Plate Readers,38,15,https://www.wired.com/story/security-news-this-week-fbi-license-plate-reader-real-time-access/,2026-05-23 15:47:52,hacker_news
The Art of Money Getting,12,0,https://kk.org/cooltools/book-freak-210-the-art-of-money-getting/,2026-05-23 15:47:52,hacker_news
BambuStudio has been violating PrusaSlicer AGPL license since their fork,285,106,https://xcancel.com/josefprusa/status/2054602354851254330,2026-05-23 15:47:52,hacker_news
The quadratic sandwich,99,7,https://fedemagnani.github.io/math/2026/04/08/the-quadratic-sandwich.html,2026-05-23 15:47:53,hacker_news
A 1955 Los Alamos computer experiment changed our understanding of chaos,25,3,https://www.lanl.gov/media/publications/1663/science-of-unpredictability,2026-05-23 15:47:53,hacker_news
ArcBrush – Node-based 2D image editor,50,15,https://arcbrush.com/,2026-05-23 15:47:53,hacker_news
US tech firms share Dutch regulator officials' names with Senate,150,111,https://www.dutchnews.nl/2026/05/us-tech-firms-share-dutch-regulator-officials-names-with-senate/,2026-05-23 15:47:53,hacker_news
Fast Factorial Algorithms,27,8,http://www.luschny.de/math/factorial/FastFactorialFunctions.htm,2026-05-23 15:47:53,hacker_news
Yeunjoo Choi from Igalia on Chromium,47,10,https://theconsensus.dev/p/2026/05/20/yeunjoo-choi-from-igalia-on-chromium.html,2026-05-23 15:47:54,hacker_news
- -dangerously-skip-reading-code – olano.dev,21,13,https://olano.dev/blog/dangerously-skip/,2026-05-23 15:47:54,hacker_news
