title,upvotes,comments,link,post_time,platform
RelaxAI – UK sovereign LLM inference at 80% cheaper than OpenAI/Claude,5,0,https://relax.ai/docs,2026-05-15 10:01:25,hacker_news
A few words on DS4,313,122,https://antirez.com/news/165,2026-05-15 10:01:25,hacker_news
UK government replaces Palantir software with internally-built refugee system,207,73,https://www.bbc.com/news/articles/c2l2j1lxdk5o,2026-05-15 10:01:25,hacker_news
Details of the Daring Airdrop at Tristan Da Cunha,138,38,https://www.tristandc.com/government/news-2026-05-11-airdrop.php,2026-05-15 10:01:26,hacker_news
First public macOS kernel memory corruption exploit on Apple M5,364,85,https://blog.calif.io/p/first-public-kernel-memory-corruption,2026-05-15 10:01:26,hacker_news
Gyroflow: Video stabilization using gyroscope data,85,15,https://github.com/gyroflow/gyroflow,2026-05-15 10:01:26,hacker_news
Solar-based sleep patterns compared to modern norms,70,59,https://dylan.gr/1775146616,2026-05-15 10:01:26,hacker_news
Codex is now in the ChatGPT mobile app,334,169,https://openai.com/index/work-with-codex-from-anywhere/,2026-05-15 10:01:27,hacker_news
Mullvad exit IPs are surprisingly identifying,382,224,https://tmctmt.com/posts/mullvad-exit-ips-as-a-fingerprinting-vector/,2026-05-15 10:01:27,hacker_news
Access to frontier AI will soon be limited by economic and security constraints,157,149,https://writing.antonleicht.me/p/cut-off,2026-05-15 10:01:27,hacker_news
Tesla Wall Connector bootloader bypasses the firmware downgrade ratchet,96,42,https://www.synacktiv.com/en/publications/exploiting-the-tesla-wall-connector-from-its-charge-port-connector-part-2-bypassing,2026-05-15 10:01:27,hacker_news
Claude for Legal,92,89,https://github.com/anthropics/claude-for-legal,2026-05-15 10:01:27,hacker_news
Porting 3D Movie Maker to Linux,126,26,https://benstoneonline.com/posts/porting-3d-movie-maker-to-linux/,2026-05-15 10:01:27,hacker_news
"What's in a GGUF, besides the weights – and what's still missing?",149,45,https://nobodywho.ooo/posts/whats-in-a-gguf/,2026-05-15 10:01:28,hacker_news
RISC-V Router,121,64,https://router.start9.com/,2026-05-15 10:01:28,hacker_news
"OVMS: Open source electric vehicle remote monitoring, diagnosis and control",80,13,https://www.openvehicles.com/home,2026-05-15 10:01:28,hacker_news
New arXiv policy: 1-year ban for hallucinated references,497,170,https://twitter.com/tdietterich/status/2055000956144935055,2026-05-15 10:01:28,hacker_news
How Claude Code works in large codebases,166,118,https://claude.com/blog/how-claude-code-works-in-large-codebases-best-practices-and-where-to-start,2026-05-15 10:01:28,hacker_news
More than sixty percent of the United States is experiencing drought conditions,200,76,https://news.vt.edu/articles/2026/05/drought-united-states-la-nina-expert.html,2026-05-15 10:01:28,hacker_news
Project Gutenberg – keeps getting better,134,44,https://www.gutenberg.org/,2026-05-15 17:17:13,hacker_news
OpenAI is connecting ChatGPT to bank accounts via Plaid,37,38,https://firethering.com/chatgpt-bank-account-plaid-openai/,2026-05-15 17:17:13,hacker_news
A 0-click exploit chain for the Pixel 10,180,77,https://projectzero.google/2026/05/pixel-10-exploit.html,2026-05-15 17:17:13,hacker_news
The sigmoids won't save you,39,37,https://www.astralcodexten.com/p/the-sigmoids-wont-save-you,2026-05-15 17:17:13,hacker_news
I built Zenith: a live local-first fixed viewport planetarium,28,2,https://smorgasb.org/zenith-tech/,2026-05-15 17:17:13,hacker_news
O(x)Caml in Space,188,37,https://gazagnaire.org/blog/2026-05-14-borealis.html,2026-05-15 17:17:13,hacker_news
Hightouch (YC S19) Is Hiring,1,0,https://hightouch.com/careers,2026-05-15 17:17:13,hacker_news
ASCII by Jason Scott,67,12,https://ascii.textfiles.com/,2026-05-15 17:17:13,hacker_news
"Image-blaster: Creates 3D environments, SFX, and meshes from a single image",15,0,https://github.com/neilsonnn/image-blaster,2026-05-15 17:17:13,hacker_news
High dimensional geometry is transforming the MRI industry(2017) [pdf],50,13,https://www.ams.org/government/DonohoPresentation06-28-17Final.pdf,2026-05-15 17:17:13,hacker_news
Show HN: Watch a neural net learn to play Snake,28,4,https://ppo.gradexp.xyz/,2026-05-15 17:17:13,hacker_news
Radicle: Sovereign {code forge} built on Git,140,38,https://radicle.dev/,2026-05-15 17:17:14,hacker_news
A new book on Steve Jobs at NeXT,112,98,https://spectrum.ieee.org/steve-jobs-next-computer,2026-05-15 17:17:14,hacker_news
We don't know why Malawi is poor,3,0,https://newsletter.deenamousa.com/p/we-dont-know-why-malawi-is-poor,2026-05-15 17:17:14,hacker_news
Amazon workers under pressure to up their AI usage are making up tasks,175,135,https://www.fastcompany.com/91541586/amazon-workers-pressured-to-up-ai-use-extraneous-tasks,2026-05-15 17:17:14,hacker_news
Trade Dollars with other startups. Book it as revenue,140,98,https://www.revswap.ai/,2026-05-15 17:17:14,hacker_news
We are retiring our bug bounty program,304,224,https://turso.tech/blog/the-wonders-of-ai,2026-05-15 17:17:14,hacker_news
Ask HN: How to be SOC2 Type 2 compliant as a solo-entreprenuer?,64,73,https://news.ycombinator.com/item?id=48145524,2026-05-15 17:17:14,hacker_news
NanoTDB – Golang Append-Only Time Series DB,30,5,https://github.com/aymanhs/nanotdb,2026-05-15 17:17:15,hacker_news
WinCE64 – Windows CE 2.11 for N64,92,25,https://github.com/ThroatyMumbo/WinCE64,2026-05-15 21:39:49,hacker_news
Mitchellh – I strongly believe there are entire companies now under AI psychosis,209,70,https://twitter.com/mitchellh/status/2055380239711457578,2026-05-15 21:39:49,hacker_news
The Zulip Foundation,98,29,https://blog.zulip.com/2026/05/15/announcing-zulip-foundation/,2026-05-15 21:39:49,hacker_news
Palantir has hired more than 30 senior UK Government officials,91,4,https://www.thenational.scot/news/26055524.palantir-hired-30-senior-uk-government-officials/,2026-05-15 21:39:50,hacker_news
California bill would require patches or refunds when online games shut down,106,49,https://arstechnica.com/gaming/2026/05/bill-to-keep-online-games-playable-clears-key-hurdle-in-california/,2026-05-15 21:39:50,hacker_news
Microscale Thermite Reaction,30,8,https://sciencedemonstrations.fas.harvard.edu/presentations/microscale-thermite-reaction,2026-05-15 21:39:50,hacker_news
U.S. DOJ demands Apple and Google unmask over 100k users of car-tinkering app,279,169,https://macdailynews.com/2026/05/15/u-s-doj-demands-apple-and-google-unmask-over-100000-users-of-popular-car-tinkering-app-in-emissions-crackdown/,2026-05-15 21:39:50,hacker_news
"Waymo updates 3,800 robotaxis after they 'drive into standing water'",113,97,https://www.cnbc.com/2026/05/12/waymo-recalls-3800-robotaxis-after-able-drive-into-standing-water.html,2026-05-15 21:39:50,hacker_news
I designed a nibble-oriented CPU in Verilog to build a scientific calculator,57,9,https://github.com/gdevic/FPGA-Calculator,2026-05-15 21:39:50,hacker_news
London Police Deploy Facial Recognition at Protest for First Time,40,18,https://reclaimthenet.org/london-police-deploy-facial-recognition-at-protest-for-first-time,2026-05-15 21:39:50,hacker_news
Meta to receive $3.3B in tax breaks for its $10B Louisiana data center,101,84,https://fortune.com/2026/05/14/meta-data-center-tax-break-hyperion-louisiana/,2026-05-15 21:39:50,hacker_news
ABC News has taken all FiveThirtyEight articles offline,130,63,https://twitter.com/baseballot/status/2055309076209492208,2026-05-15 21:39:50,hacker_news
The nuclear-physics infrastructure behind PET scans,24,1,https://www.lanl.gov/media/publications/1663/proton-power-for-public-health,2026-05-15 21:39:50,hacker_news
The day the Pintupi Nine entered the modern world,7,0,https://www.bbc.com/news/magazine-30500591,2026-05-15 21:39:50,hacker_news
Zenith: a live local-first fixed viewport planetarium,60,14,https://smorgasb.org/zenith-tech/,2026-05-15 21:39:51,hacker_news
Building a UMatrix Replacement,24,8,https://lock.cmpxchg8b.com/umatrix.html,2026-05-15 21:39:51,hacker_news
The CTF scene is dead,4,0,https://kabir.au/blog/the-ctf-scene-is-dead,2026-05-16 07:33:22,hacker_news
Ploopy Bean: a trackpoint for every computer,80,33,https://ploopy.co/shop/bean-pointing-stick/,2026-05-16 07:33:22,hacker_news
SQL patterns I use to catch transaction fraud,137,34,https://analytics.fixelsmith.com/posts/sql-fraud-patterns/,2026-05-16 07:33:22,hacker_news
I believe there are entire companies right now under AI psychosis,1221,571,https://twitter.com/mitchellh/status/2055380239711457578,2026-05-16 07:33:22,hacker_news
The bird eye was pushed to an evolutionary extreme,90,23,https://www.quantamagazine.org/how-the-bird-eye-was-pushed-to-an-evolutionary-extreme-20260513/,2026-05-16 07:33:22,hacker_news
Research on mildew contamination affecting the sound quality of analog tapes,16,1,https://www.nature.com/articles/s40494-026-02592-7,2026-05-16 07:33:22,hacker_news
Additive Blending on the Nintendo 64,90,8,https://phoboslab.org/log/2026/05/n64-additive-blending,2026-05-16 07:33:22,hacker_news
The main thing about P2P meth is that there's so much of it (2021),108,103,https://dynomight.net/p2p-meth/,2026-05-16 07:33:22,hacker_news
California's Battery Array Is as Powerful as 12 Nuclear Power Plants,15,3,https://zolairenergy.com/californias-battery-array-is-as-powerful-as-12-nuclear-power-plants-heres-whats-on-the-horizon/,2026-05-16 07:33:22,hacker_news
Naturally Occurring Quasicrystals,89,9,https://johncarlosbaez.wordpress.com/2026/05/14/naturally-occurring-quasicrystals/,2026-05-16 07:33:23,hacker_news
Gaining control of every projector and camera on campus,12,1,https://www.edna.land/blogs/posts/scanning/,2026-05-16 07:33:23,hacker_news
England Runestones,31,8,https://en.wikipedia.org/wiki/England_runestones,2026-05-16 07:33:23,hacker_news
How to Write to SSDs [pdf],91,10,https://www.vldb.org/pvldb/vol19/p1469-lee.pdf,2026-05-16 07:33:23,hacker_news
I Bought a “Junk” PSP From Japan,45,13,https://gardinerbryant.com/i-bought-a-junk-psp-from-japan-heres-how-it-went/,2026-05-16 07:33:23,hacker_news
"Orthrus-Qwen3: up to 7.8×tokens/forward on Qwen3, identical output distribution",60,4,https://github.com/chiennv2000/orthrus,2026-05-16 07:33:23,hacker_news
ESP-EEG is an affordable 8-channel biosensing board,41,14,https://www.autodidacts.io/cerelog-esp-eeg-affordable-openbci-like-board/,2026-05-16 07:33:23,hacker_news
Show HN: Epiq – Distributed Git based issue tracker TUI,46,13,https://ljtn.github.io/epiq/,2026-05-16 07:33:23,hacker_news
NYT and vaping: How to lie by saying only true things (2022),85,34,https://gwern.net/vaping,2026-05-16 07:33:24,hacker_news
Matlab: Communications Toolbox,3,0,https://www.mathworks.com/products/communications.html,2026-05-16 07:33:24,hacker_news
Erlang/OTP 29.0,174,28,https://www.erlang.org/news/188,2026-05-16 07:33:24,hacker_news
"SANA-WM, a 2.6B open-source world model for 1-minute 720p video",118,51,https://nvlabs.github.io/Sana/WM/,2026-05-16 15:39:03,hacker_news
Accelerando (2005),118,54,https://www.antipope.org/charlie/blog-static/fiction/accelerando/accelerando.html,2026-05-16 15:39:04,hacker_news
Accelerate,24,3,https://github.com/AccelerateHS/accelerate,2026-05-16 15:39:04,hacker_news
Δ-Mem: Efficient Online Memory for Large Language Models,129,27,https://arxiv.org/abs/2605.12357,2026-05-16 15:39:04,hacker_news
"Moving away from Tailwind, and learning to structure my CSS",137,68,https://jvns.ca/blog/2026/05/15/moving-away-from-tailwind--and-learning-to-structure-my-css-/,2026-05-16 15:39:04,hacker_news
My Favorite Bugs: Invalid Surrogate Pairs,31,8,https://george.mand.is/2026/05/my-favorite-bugs-invalid-surrogate-pairs/,2026-05-16 15:39:04,hacker_news
Greek Alphabet Cards,31,7,https://labs.randomquark.com/alphabet_cards/,2026-05-16 15:39:04,hacker_news
How an Australian Teen Team Is Making Radio Astronomy Affordable for Schools,3,0,https://mag.openrockets.com/p/how-an-australian-teen-team-is-making-radio-astronomy-affordable-for-rural-schools-4894opuisyhfdisubgi/?b=2,2026-05-16 15:39:04,hacker_news
Futhark by Example,74,20,https://futhark-lang.org/examples.html,2026-05-16 15:39:04,hacker_news
DeepSeek-V4-Flash means LLM steering is interesting again,13,0,https://www.seangoedecke.com/steering-vectors/,2026-05-16 15:39:04,hacker_news
"After 8 years, I rewrote my open-source PyTorch curvature library",16,1,https://github.com/noahgolmant/pytorch-hessian-eigenthings,2026-05-16 15:39:04,hacker_news
Kyber (YC W23) Is Hiring a Founding Marketer,1,0,https://www.ycombinator.com/companies/kyber/jobs/1rLQAro-founding-marketer-content-community,2026-05-16 15:39:04,hacker_news
Points are a weird and inconsistent unit of measure,36,21,https://buttondown.com/hillelwayne/archive/points-are-a-weird-and-inconsistent-unit-of/,2026-05-16 15:39:05,hacker_news
"Nearly 50 Years Later, WKRP in Cincinnati Becomes a Real Radio Station",55,28,https://www.openculture.com/2026/05/nearly-50-years-later-wkrp-in-cincinnati-becomes-a-real-radio-station.html,2026-05-16 15:39:05,hacker_news
Frontier AI has broken the open CTF format,244,214,https://kabir.au/blog/the-ctf-scene-is-dead,2026-05-16 15:39:05,hacker_news
What Were Ancient Greco-Roman Curse Tablets?,3,0,https://www.history.com/articles/what-were-ancient-roman-curse-tablets,2026-05-16 15:39:05,hacker_news
The Physics–and Physicality–Of Extreme Juggling (2018),14,2,https://www.wired.com/story/the-physicsand-physicalityof-extreme-juggling/,2026-05-16 15:39:05,hacker_news
Fecal transplants for autism deliver success in clinical trials,159,116,https://refractor.io/adhd-autism/fecal-transplants-for-autism-delivers-success-in-clinical-trials/,2026-05-16 15:39:05,hacker_news
Tesla reveals two Robotaxi crashes involving teleoperators,4,0,https://techcrunch.com/2026/05/15/tesla-reveals-two-robotaxi-crashes-involving-teleoperators/,2026-05-16 15:39:06,hacker_news
"Where to buy a non-Apple, non-Google smartphone",142,88,https://www.theregister.com/on-prem/2026/05/01/where-to-buy-a-non-apple-non-google-smartphone/5219681,2026-05-16 15:39:06,hacker_news
Kioxia and Dell cram 10 PB into slim 2RU server,64,40,https://www.blocksandfiles.com/flash/2026/05/14/kioxia-and-dell-cram-10-pb-into-slim-2ru-server/5240574,2026-05-16 20:33:24,hacker_news
Windows 9x Subsystem for Linux,120,47,https://codeberg.org/hails/wsl9x,2026-05-16 20:33:24,hacker_news
OpenAI and Malta partner to bring ChatGPT Plus to all citizens,10,4,https://openai.com/index/malta-chatgpt-plus-partnership/,2026-05-16 20:33:24,hacker_news
An australian teen team is making radio astronomy affordable for rural schools,97,24,https://mag.openrockets.com/p/how-an-australian-teen-team-is-making-radio-astronomy-affordable-for-rural-schools-4894opuisyhfdisubgi/?b=2,2026-05-16 20:33:25,hacker_news
Fame! A Misunderstanding: A new translation of Albert Camus's complete notebooks,18,2,https://lareviewofbooks.org/article/albert-camus-complete-notebooks-ryan-bloom-existentialism-absurd/,2026-05-16 20:33:25,hacker_news
Clusters become personal (like PCs did),35,24,https://aranya.tech/blog/arrival-of-the-personal-cluster,2026-05-16 20:33:25,hacker_news
HTML Lists,234,47,https://blog.frankmtaylor.com/2026/05/13/you-dont-know-html-lists/,2026-05-16 20:33:25,hacker_news
Japan runs out of robot wolves in fight against bears,24,11,https://www.popsci.com/environment/japan-robot-wolf-army/,2026-05-16 20:33:25,hacker_news
Show HN: Rocksky – Music scrobbling and discovery on the AT Protocol,28,10,https://tangled.org/rocksky.app/rocksky,2026-05-16 20:33:26,hacker_news
Futhark by example,97,24,https://futhark-lang.org/examples.html,2026-05-16 20:33:26,hacker_news
We've made the world too complicated,80,91,https://user8.bearblog.dev/the-world-is-too-complicated/,2026-05-16 20:33:26,hacker_news
A molecule with half-Möbius topology,9,0,https://www.science.org/doi/10.1126/science.aea3321,2026-05-16 20:33:26,hacker_news
Technofascism,48,12,https://third-bit.com/2026/05/15/technofascism/,2026-05-16 20:33:27,hacker_news
Zerostack – A Unix-inspired coding agent written in pure Rust,365,150,https://crates.io/crates/zerostack/1.0.0,2026-05-17 08:35:23,hacker_news
Mozilla to UK regulators: VPNs are essential privacy and security tools,121,24,https://blog.mozilla.org/netpolicy/2026/05/15/mozilla-to-uk-regulators-vpns-are-essential-privacy-and-security-tools-and-should-not-be-undermined/,2026-05-17 08:35:23,hacker_news
Colossus: The Forbin Project,92,19,https://en.wikipedia.org/wiki/Colossus:_The_Forbin_Project,2026-05-17 08:35:24,hacker_news
Hosting a website on an 8-bit microcontroller,117,9,https://maurycyz.com/projects/mcusite/,2026-05-17 08:35:24,hacker_news
A nicer voltmeter clock,162,22,https://lcamtuf.substack.com/p/a-nicer-voltmeter-clock,2026-05-17 08:35:24,hacker_news
C++26 Shipped a SIMD Library Nobody Asked For,115,62,https://lucisqr.substack.com/p/c26-shipped-a-simd-library-nobody,2026-05-17 08:35:24,hacker_news
OpenAI and Government of Malta partner to roll out ChatGPT Plus to all citizens,171,184,https://openai.com/index/malta-chatgpt-plus-partnership/,2026-05-17 08:35:24,hacker_news
Twilight of the Velocipede: Typesetting Races Before the Age of Linotype,8,0,https://publicdomainreview.org/essay/twilight-of-the-velocipede/,2026-05-17 08:35:24,hacker_news
Illusions of Understanding in the Sciences,37,10,https://link.springer.com/article/10.1007/s42113-026-00271-1,2026-05-17 08:35:25,hacker_news
Why did Clovis toolmakers choose difficult quartz crystal?,23,9,https://phys.org/news/2026-04-clovis-toolmakers-difficult-quartz-crystal.html,2026-05-17 08:35:25,hacker_news
MCP Hello Page,91,31,https://www.hybridlogic.co.uk/blog/2026/05/mcp-hello-page,2026-05-17 08:35:25,hacker_news
Unknowable Math Can Help Hide Secrets,49,9,https://www.quantamagazine.org/how-unknowable-math-can-help-hide-secrets-20260511/,2026-05-17 08:35:25,hacker_news
Citroën metropolis concept car (2010),23,9,https://www.citroenet.org.uk/prototypes/metropolis/metropolis1.html,2026-05-17 08:35:25,hacker_news
Halt and Catch Fire,134,68,https://unstack.io/halt-and-catch-fire,2026-05-17 08:35:25,hacker_news
δ-mem: Efficient Online Memory for Large Language Models,210,57,https://arxiv.org/abs/2605.12357,2026-05-17 08:35:26,hacker_news
Self-Distillation Enables Continual Learning [pdf],56,15,https://arxiv.org/abs/2601.19897,2026-05-17 08:35:26,hacker_news
The Third Hard Problem,71,40,https://mmapped.blog/posts/48-the-third-hard-problem,2026-05-17 08:35:26,hacker_news
Tesla Solar Roof is on life support as it pivot to panels,67,49,https://electrek.co/2026/05/14/tesla-solar-roof-promise-vs-reality-pivot-panels/,2026-05-17 08:35:26,hacker_news
Grafana Labs internal source code accessed,49,12,https://twitter.com/grafana/status/2055827123236171827,2026-05-17 08:35:26,hacker_news
3D Gaussian Splatting in a Weekend,86,10,https://bfeldman.me/3dgs-weekend/,2026-05-17 08:35:26,hacker_news
I don't think AI will make your processes go faster,211,143,https://frederickvanbrabant.com/blog/2026-05-15-i-dont-think-ai-will-make-your-processes-go-faster/,2026-05-17 15:42:55,hacker_news
I turned a $80 RK3562 Android tablet into a Debian Linux workstation,38,9,https://github.com/tech4bot/rk3562deb,2026-05-17 15:42:55,hacker_news
"Native all the way, until you need text",221,150,https://justsitandgrin.im/posts/native-all-the-way-until-you-need-text/,2026-05-17 15:42:55,hacker_news
Every AI Subscription Is a Ticking Time Bomb for Enterprise,162,118,https://www.thestateofbrand.com/news/ai-subscription-time-bomb,2026-05-17 15:42:55,hacker_news
"Security researcher says Microsoft built a Bitlocker backdoor, releases exploit",166,69,https://www.techspot.com/news/112410-security-researcher-microsoft-secretly-built-backdoor-bitlocker-releases.html,2026-05-17 15:42:55,hacker_news
Hindenburg's Smoking Room,23,6,https://www.airships.net/hindenburg-smoking-room/,2026-05-17 15:42:55,hacker_news
Apple Silicon costs more than OpenRouter,160,132,https://www.williamangel.net/blog/2026/05/17/offline-llm-energy-use.html,2026-05-17 15:42:55,hacker_news
Prolog Basics Explained with Pokémon,108,16,https://unplannedobsolescence.com/blog/prolog-basics-pokemon/,2026-05-17 15:42:56,hacker_news
WHO Declares Ebola Outbreak a Global Health Emergency,118,47,https://www.nytimes.com/2026/05/17/world/africa/ebola-congo-uganda-who-public-health-emergency.html,2026-05-17 15:42:56,hacker_news
CUDA Books,20,0,https://github.com/alternbits/awesome-cuda-books,2026-05-17 15:42:56,hacker_news
AI is a technology not a product,78,21,https://daringfireball.net/2026/05/ai_is_technology_not_a_product,2026-05-17 15:42:56,hacker_news
Agentic Trading with Safe Guardrails,14,3,https://github.com/ShurikenTrade/shuriken-skills,2026-05-17 15:42:56,hacker_news
Scientists believe ibogaine can help veterans overcome PTSD,23,14,https://www.bbc.com/future/article/20260514-how-hallucinogenic-ibogaine-helps-veterans-overcome-ptsd,2026-05-17 15:42:56,hacker_news
High-Entropy Alloy,25,2,https://en.wikipedia.org/wiki/High-entropy_alloy,2026-05-17 15:42:56,hacker_news
How Diamonds Are Made,48,22,https://diamond.jaydip.me/,2026-05-17 15:42:56,hacker_news
Mado: Fast Markdown linter written in Rust,25,2,https://github.com/akiomik/mado,2026-05-17 15:42:57,hacker_news
Roman Letters,70,10,https://romanletters.org/,2026-05-17 15:42:57,hacker_news
"Mercurial, 20 years and counting: how are we still alive and kicking? [video]",88,51,https://fosdem.org/2026/schedule/event/AGWUVH-mercurial-aint-you-dead-yet/,2026-05-17 20:35:33,hacker_news
The occasional ECONNRESET,60,12,https://movq.de/blog/postings/2026-05-05/1/POSTING-en.html,2026-05-17 20:35:33,hacker_news
Schanuel's Conjecture and the Semantics of Triton's FPSan,10,3,https://cp4space.hatsya.com/2026/05/03/schanuels-conjecture-and-the-semantics-of-fpsan/,2026-05-17 20:35:34,hacker_news
Magical Realism: “Northern Exposure” 25 Years Later (2015),7,2,https://www.rogerebert.com/streaming/magical-realism-nothern-exposure-25-years-later,2026-05-17 20:35:34,hacker_news
Meta deletes popular 1M follower account after Kuwaiti request,155,87,https://twitter.com/ryangrim/status/2055992439031185782,2026-05-17 20:35:34,hacker_news
Don’t Outsource the Learning,19,6,https://addyosmani.com/blog/dont-outsource-learning/,2026-05-17 20:35:34,hacker_news
Scientists “bottle the sun” with a liquid battery that stores solar energy,25,14,https://www.sciencedaily.com/releases/2026/05/260513221821.htm,2026-05-17 20:35:34,hacker_news
Canada’s Bill C-22 would weaken protections on private messages,85,18,https://opencivics-labs.github.io/dontsurveil.me/c22.html,2026-05-17 20:35:34,hacker_news
AI subscriptions are a ticking time bomb for enterprise,343,350,https://www.thestateofbrand.com/news/ai-subscription-time-bomb,2026-05-17 20:35:35,hacker_news
"XS: A programming language. Anywhere, anytime, by anyone",45,28,https://xslang.org,2026-05-17 20:35:35,hacker_news
Show HN: Semble – Code search for agents that uses 98% fewer tokens than grep,23,14,https://github.com/MinishLab/semble,2026-05-17 20:35:35,hacker_news
How diamonds are made,69,48,https://diamond.jaydip.me/,2026-05-17 20:35:35,hacker_news
I automated opt-outs for 500 data broker sites (open source),99,34,https://github.com/stephenlthorn/auto-identity-remove,2026-05-18 12:52:27,hacker_news
The foundations of a provably secure operating system (PSOS) (1979) [pdf],55,27,http://www.csl.sri.com/users/neumann/psos.pdf,2026-05-18 12:52:28,hacker_news
Dogme 25 – Vow of Chastity,19,28,https://dogma25.dk/,2026-05-18 12:52:28,hacker_news
Eric Schmidt speech about AI booed during graduation,140,86,https://www.nbcnews.com/tech/tech-news/former-google-ceo-booed-graduation-speech-ai-rcna345585,2026-05-18 12:52:28,hacker_news
GenCAD,368,92,https://gencad.github.io/,2026-05-18 12:52:28,hacker_news
It is time to give up the dualism introduced by the debate on consciousness,158,362,https://www.noemamag.com/there-is-no-hard-problem-of-consciousness/,2026-05-18 12:52:28,hacker_news
Crystals found inside wreckage from the first nuclear bomb test,114,41,https://www.scientificamerican.com/article/strange-crystals-found-inside-wreckage-from-the-first-nuclear-bomb-test/,2026-05-18 12:52:28,hacker_news
NASA still maintains some of the Voyager spacecraft code from the 70s era,34,35,https://spacedaily.com/nasa-still-maintains-some-of-the-voyager-spacecraft-code-in-a-1970s-era-programming-language-that-almost-nobody-on-earth-fully-understands-anymore-and-the-handful-of-engineers-who-do-are-now-in-their/,2026-05-18 12:52:28,hacker_news
Math Jokes in Alice in Wonderland,18,4,https://storica.club/blog/alice-is-math-jokes/,2026-05-18 12:52:28,hacker_news
Ask an Astronaut: 333 hours of Q&A footage with astronauts,166,18,https://askanastronaut.issinrealtime.org/,2026-05-18 12:52:28,hacker_news
Linux security mailing list 'almost unmanageable',13,3,https://www.theregister.com/security/2026/05/18/linus-torvalds-says-ai-powered-bug-hunters-have-made-linux-security-mailing-list-almost-entirely-unmanageable/5241633,2026-05-18 12:52:29,hacker_news
Jank now has its own custom IR,174,35,https://jank-lang.org/blog/2026-05-08-optimization/,2026-05-18 12:52:29,hacker_news
Graphing Scientific Calculator Based on the ESP32,15,5,https://github.com/El-EnderJ/NeoCalculator,2026-05-18 12:52:29,hacker_news
WHO declares major outbreak of Ebola virus species an international emergency,6,0,https://www.science.org/content/article/major-outbreak-rare-ebola-virus-species-northern-congo-alarms-scientists,2026-05-18 12:52:29,hacker_news
Where Are the Vibecoded Photoshops?,163,195,https://indiepixel.de/blog/posts/where-are-the-vibecoded-photoshops/,2026-05-18 12:52:29,hacker_news
WriteUp: 16 Bytes of x86 that turn Matrix rain into sound,161,31,https://hellmood.111mb.de//wake_up_16b_writeup.html,2026-05-18 12:52:29,hacker_news
Profunctor Equipment in Haskell,30,5,https://bartoszmilewski.com/2026/05/16/profunctor-equipment-in-haskell/,2026-05-18 12:52:29,hacker_news
