title,upvotes,comments,link,post_time,platform
Prolog Coding Horror,156,65,https://www.metalevel.at/prolog/horror,2026-05-18 12:52:29,hacker_news
Utah lawmakers form united front in push to ban prediction markets,6,0,https://www.theguardian.com/us-news/2026/may/18/you-can-bet-on-it-utah-lawmakers-form-united-front-in-push-to-ban-prediction-markets,2026-05-18 12:52:29,hacker_news
Don't Answer the First Question,7,3,https://lalitm.com/post/dont-answer-the-first-question/,2026-05-18 12:52:30,hacker_news
Build a Radio Wave Detector with Balls of Aluminum Foil,22,8,https://www.wired.com/story/build-a-radio-wave-detector-with-balls-of-aluminum-foil/,2026-05-18 12:52:30,hacker_news
"Two EA-18 fighter jets collide at Mountain Home airshow, pilots ejected safely",215,215,https://idahonews.com/news/local/two-f-18-fighter-jets-have-crashed-during-an-airshow-at-mountain-home-air-force-base,2026-05-18 12:52:30,hacker_news
kharp – k version 3 Language Interpreter in C#,42,9,https://github.com/ERufian/ksharp,2026-05-18 12:52:30,hacker_news
Anthropic acquires Stainless,274,196,https://www.anthropic.com/news/anthropic-acquires-stainless,2026-05-18 21:55:11,hacker_news
"Hyperpolyglot Lisp: Common Lisp, Racket, Clojure, Emacs Lisp",73,10,https://hyperpolyglot.org/lisp,2026-05-18 21:55:11,hacker_news
We stopped AI bot spam in our GitHub repo using Git's –author flag,348,171,https://archestra.ai/blog/only-responsible-ai,2026-05-18 21:55:12,hacker_news
We let AIs run radio stations,78,92,https://andonlabs.com/blog/andon-fm,2026-05-18 21:55:12,hacker_news
Show HN: Files.md – Open-source alternative to Obsidian,466,247,https://github.com/zakirullin/files.md,2026-05-18 21:55:12,hacker_news
Elon Musk has lost his lawsuit against Sam Altman and OpenAI,605,306,https://techcrunch.com/2026/05/18/elon-musk-has-lost-his-lawsuit-against-sam-altman-and-openai/,2026-05-18 21:55:12,hacker_news
Agora-1: The Multi-Agent World Model,50,10,https://odyssey.ml/introducing-agora-1,2026-05-18 21:55:12,hacker_news
The Quiet Renovation at Bitwarden,411,198,https://blog.ppb1701.com/the-quiet-renovation-at-bitwarden,2026-05-18 21:55:12,hacker_news
Understanding Singleflight in Go,25,1,https://www.codingexplorations.com/blog/understanding-singleflight-in-golang-a-solution-for-eliminating-redundant-work,2026-05-18 21:55:12,hacker_news
The FBI Wants to Buy Nationwide Access to License Plate Readers,117,43,https://www.404media.co/the-fbi-wants-to-buy-nationwide-access-to-license-plate-readers/,2026-05-18 21:55:12,hacker_news
"Show HN: We missed Winamp, so we built an audio player for macOS",38,31,https://www.advanced-research.net/180db,2026-05-18 21:55:12,hacker_news
Who will buy your services if you fire us all?,11,0,https://carette.xyz/posts/who_will_buy_your_services/,2026-05-18 21:55:12,hacker_news
"Two computers, one monitor, zero fiddling (2025)",125,76,https://alexplescan.com/posts/2025/08/16/kvm/,2026-05-18 21:55:12,hacker_news
The Fil-C Optimized Calling Convention,77,11,https://fil-c.org/calling_convention,2026-05-18 21:55:13,hacker_news
Shutterstock to pay $35M over hard-to-cancel subscriptions,61,23,https://www.ftc.gov/news-events/news/press-releases/2026/05/shutterstock-pay-35-million-settle-ftc-allegations-over-illegal-subscription-cancellation-practices,2026-05-18 21:55:13,hacker_news
"Cutting inference cold starts by 40x with LP, FUSE, C/R, and CUDA-checkpoint",54,11,https://modal.com/blog/truly-serverless-gpus,2026-05-18 21:55:13,hacker_news
Iran starts Bitcoin-backed ship insurance for Hormuz strait,183,270,https://www.bloomberg.com/news/articles/2026-05-18/iran-starts-bitcoin-backed-shipping-insurance-for-hormuz-strait,2026-05-18 21:55:13,hacker_news
Project Glasswing: what Mythos showed us,244,90,https://blog.cloudflare.com/cyber-frontier-models/,2026-05-18 21:55:13,hacker_news
loopmaster – Livecoding Music IDE,24,8,https://loopmaster.xyz/,2026-05-18 21:55:13,hacker_news
Haiku OS runs on M1 Macs now,219,74,https://discuss.haiku-os.org/t/my-haiku-arm64-progress/19044?page=2,2026-05-18 21:55:13,hacker_news
Designing an FPGA Calculator from Scratch,10,0,https://baltazarstudios.com/calculator/,2026-05-18 21:55:13,hacker_news
What Is Date:Italy?,109,45,http://aesthetikx.info/blog/date_italy.html,2026-05-18 21:55:13,hacker_news
Stratum: System-Hardware Co-Design with 3D-Stackable DRAM for Efficient Moe,13,4,https://dl.acm.org/doi/10.1145/3725843.3756043,2026-05-18 21:55:13,hacker_news
Voice AI Systems Are Vulnerable to Hidden Audio Attacks,98,27,https://spectrum.ieee.org/voice-ai-audio-attacks,2026-05-18 21:55:14,hacker_news
I 3D Printed Origami [video],45,9,https://www.youtube.com/watch?v=FNVBK7-h9Fs,2026-05-18 21:55:14,hacker_news
Learn Harness Engineering,106,11,https://walkinglabs.github.io/learn-harness-engineering/en/,2026-05-18 21:55:14,hacker_news
Gaussian Splat of a Strawberry,64,31,https://superspl.at/scene/84df8849,2026-05-19 11:43:25,hacker_news
Photo GIMP – A Patch for GIMP 3 for Photoshop Users,24,10,https://github.com/Diolinux/PhotoGIMP,2026-05-19 11:43:26,hacker_news
I Found Ultra-Pure Quantum Crystals in an Abandoned Mine in the Atacama Desert,95,22,https://medium.com/@breid.at/ultra-pure-quantum-crystals-from-an-abandoned-mine-in-a-mysterious-desert-93cc87d12314,2026-05-19 11:43:26,hacker_news
Polypad,95,8,https://polypad.amplify.com/,2026-05-19 11:43:26,hacker_news
Peter Neumann has died,151,9,https://www.tuhs.org/pipermail/tuhs/2026-May/033748.html,2026-05-19 11:43:26,hacker_news
Click (2016),317,79,https://clickclickclick.click/,2026-05-19 11:43:26,hacker_news
Kv4p HT – A homebrew 1W radio (VHF or UHF) that plugs into an Android phone,101,35,https://www.kv4p.com/,2026-05-19 11:43:27,hacker_news
The last six months in LLMs in five minutes,491,364,https://simonwillison.net/2026/May/19/5-minute-llms/,2026-05-19 11:43:27,hacker_news
Cursor Introduces Composer 2.5,167,123,https://cursor.com/blog/composer-2-5,2026-05-19 11:43:27,hacker_news
The lasting influence of Netscape Time,46,8,https://thehistoryoftheweb.com/the-lasting-influence-of-netscape-time/,2026-05-19 11:43:27,hacker_news
PyTorch Landscape,50,12,https://pytorch.landscape2.io,2026-05-19 11:43:27,hacker_news
Mini Shai-Hulud Strikes Again: 314 npm Packages Compromised,125,64,https://safedep.io/mini-shai-hulud-strikes-again-314-npm-packages-compromised/,2026-05-19 11:43:28,hacker_news
"1024000^2 Blocks, 2B2T Minecraft Server World Download Project, and Discoveries",149,91,https://github.com/2b2tplace/1m_release,2026-05-19 11:43:28,hacker_news
"Regex Chess: A 2-ply minimax chess engine in 84,688 regular expressions",138,30,https://nicholas.carlini.com/writing/2025/regex-chess.html,2026-05-19 11:43:28,hacker_news
Pope Leo XIV’s first encyclical Magnifica humanitas to be published May 25,241,155,https://www.vaticannews.va/en/pope/news/2026-05/pope-leo-xiv-first-encyclical-magnifica-humanitas.html,2026-05-19 11:43:28,hacker_news
"Show HN: Number Gacha, a gacha game distilled to its essence",168,66,https://isabisabel.com/gacha/,2026-05-19 11:43:29,hacker_news
Make ZIP files smaller with ZIP Shrinker,34,19,https://evanhahn.com/make-zip-files-smaller-with-zip-shrinker/,2026-05-19 11:43:29,hacker_news
Show HN: Hsrs – Type-Safe Haskell Bindings Generator for Rust,36,3,https://github.com/harmont-dev/hsrs,2026-05-19 11:43:29,hacker_news
AI eats the world (Spring 26) [pdf],248,137,https://static1.squarespace.com/static/50363cf324ac8e905e7df861/t/6a0af5d0484fbf5fe9a7743e/1779103184855/2026-Spring-AI.pdf,2026-05-19 11:43:29,hacker_news
Peter Salus has died,145,12,https://www.tuhs.org/pipermail/tuhs/2026-May/033750.html,2026-05-19 11:43:29,hacker_news
When can the C++ compiler devirtualize a call?,68,50,https://quuxplusone.github.io/blog/2021/02/15/devirtualization/,2026-05-19 11:43:30,hacker_news
I’ve built a virtual museum with nearly every operating system you can think of,268,55,https://virtualosmuseum.org/,2026-05-19 18:27:13,hacker_news
Apple unveils new accessibility features,429,230,https://www.apple.com/newsroom/2026/05/apple-unveils-new-accessibility-features-and-updates-with-apple-intelligence/,2026-05-19 18:27:13,hacker_news
I’ve joined Anthropic,747,281,https://twitter.com/karpathy/status/2056753169888334312,2026-05-19 18:27:13,hacker_news
"Gentoo News: Copy Fail, Dirty Frag, and Fragnesia Kernel Vulnerabilities",58,13,https://www.gentoo.org/news/2026/05/19/copy-fail-fragnesia-vulnerabilities.html,2026-05-19 18:27:13,hacker_news
Show HN: Superlog (YC P26) – Observability that installs itself and fixes bugs,27,25,https://superlog.sh/,2026-05-19 18:27:13,hacker_news
Gemini 3.5: frontier intelligence with action,80,32,https://blog.google/innovation-and-ai/models-and-research/gemini-models/gemini-3-5/,2026-05-19 18:27:14,hacker_news
Intro to TLA+ for the LLM Era: Prompt Your Way to Victory,66,16,https://emptysqua.re/blog/intro-to-tla-plus-for-the-llm-era/,2026-05-19 18:27:14,hacker_news
CISA Admin Leaked AWS GovCloud Keys on GitHub,267,121,https://krebsonsecurity.com/2026/05/cisa-admin-leaked-aws-govcloud-keys-on-github/,2026-05-19 18:27:14,hacker_news
Hanoi’s humble beer glass and the memory of a nation,81,13,https://sundaylongread.com/2026/05/15/hanois-humble-beer-glass-and-the-memory-of-a-nation/,2026-05-19 18:27:14,hacker_news
Google I/O,128,146,https://io.google/2026/,2026-05-19 18:27:14,hacker_news
KV Cache Is Becoming the Memory Hierarchy of Inference,6,0,https://touchdown-labs.com/blog/kv-cache-memory-hierarchy-inference.html,2026-05-19 18:27:14,hacker_news
"KV Sharing, MHC, and Compressed Attention",7,0,https://magazine.sebastianraschka.com/p/recent-developments-in-llm-architectures,2026-05-19 18:27:14,hacker_news
Show HN: I made a 3D pose maker for artists,51,26,https://setpose.com/,2026-05-19 18:27:15,hacker_news
Cursor Cloud Agents Down,4,1,https://forum.cursor.com/t/cloud-agents-broken-ii/161036,2026-05-19 18:27:15,hacker_news
Show HN: Haystack – Review the PRs that need human attention,10,5,https://haystackeditor.com/,2026-05-19 18:27:15,hacker_news
An Apple (II) for Teacher,43,12,https://technicshistory.com/2026/05/19/an-apple-ii-for-teacher/,2026-05-19 18:27:15,hacker_news
OpenBSD 7.9,278,192,https://www.openbsd.org/79.html,2026-05-19 18:27:15,hacker_news
Google IO 26 Keynote [video],26,2,https://www.youtube.com/watch?v=wYSncx9zLIU,2026-05-19 18:27:15,hacker_news
Everything in C is undefined behavior,196,247,https://blog.habets.se/2026/05/Everything-in-C-is-undefined-behavior.html,2026-05-20 10:38:56,hacker_news
Gemini 3.5 Flash,804,560,https://blog.google/innovation-and-ai/models-and-research/gemini-models/gemini-3-5/,2026-05-20 10:38:56,hacker_news
FiveThirtyEight articles on the Internet Archive,208,49,https://fivethirtyeightindex.com/,2026-05-20 10:38:56,hacker_news
Learnings from 100K lines of Rust with AI (2025),12,4,https://zfhuang99.github.io/rust/claude%20code/codex/contracts/spec-driven%20development/2025/12/01/rust-with-ai.html,2026-05-20 10:38:56,hacker_news
Infomaniak transitions to a foundation model to protect user data privacy,81,18,https://news.infomaniak.com/en/infomaniak-foundation-sovereign-cloud/,2026-05-20 10:38:56,hacker_news
Japan is gripped by mass allergies. A 1950s project is to blame,117,43,https://www.bbc.com/future/article/20260515-the-1950s-blunder-which-causes-mass-hay-fever-in-japan,2026-05-20 10:38:57,hacker_news
Google changes its search box,558,739,https://blog.google/products-and-platforms/products/search/search-io-2026/,2026-05-20 10:38:57,hacker_news
Show HN: Forge – Guardrails take an 8B model from 53% to 99% on agentic tasks,499,174,https://github.com/antoinezambelli/forge,2026-05-20 10:38:57,hacker_news
Remove-AI-Watermarks – CLI and library for removing AI watermarks from images,288,169,https://github.com/wiltodelta/remove-ai-watermarks,2026-05-20 10:38:57,hacker_news
Mistral AI acquires Emmi AI,265,80,https://www.emmi.ai/news/mistral-ai-acquires-emmi-ai,2026-05-20 10:38:57,hacker_news
OpenAI Adopts Google's SynthID Watermark for AI Images with Verification Tool,284,154,https://openai.com/index/advancing-content-provenance/,2026-05-20 10:38:57,hacker_news
Incident Report: Railway Blocked by Google Cloud (Resolved),480,307,https://blog.railway.com/p/incident-report-may-19-2026-gcp-account-outage,2026-05-20 10:38:58,hacker_news
"Gemini CLI will stop working from June 18, 2026",227,122,https://developers.googleblog.com/an-important-update-transitioning-gemini-cli-to-antigravity-cli/,2026-05-20 10:38:58,hacker_news
CopyFail: From Pod to Host,21,0,https://xint.io/blog/copy-fail-pod-to-host,2026-05-20 10:38:58,hacker_news
RISC-V and Floating-Point,21,16,https://fprox.substack.com/p/risc-v-and-floating-point,2026-05-20 10:38:58,hacker_news
"The weird, wild story of humanity's obsession with gold",3,0,https://www.economist.com/culture/2026/05/14/the-weird-wild-story-of-humanitys-obsession-with-gold,2026-05-20 10:38:58,hacker_news
In 1979 engineer Hugh Padgham discovered gated reverb – by accident,48,16,https://producelikeapro.com/blog/how-one-recording-mistake-created-a-musical-phenomenon-in-the-80s/,2026-05-20 10:38:58,hacker_news
Show HN: Typeset sitelen pona and copy a PNG (for toki pona speakers),3,0,https://sitelen.vercel.app/,2026-05-20 10:38:59,hacker_news
Nostalgic Kits Central (2024),23,11,https://www.nostalgickitscentral.com/,2026-05-20 10:38:59,hacker_news
GitHub is investigating unauthorized access to their internal repositories,454,239,https://twitter.com/github/status/2056884788179726685,2026-05-20 10:38:59,hacker_news
Minnesota becomes first state to ban prediction markets,666,202,https://www.npr.org/2026/05/19/nx-s1-5821265/minnesota-ban-prediction-markets,2026-05-20 10:38:59,hacker_news
Testing MiniMax M2.7 via API on three real ML and coding workflows,25,1,https://andlukyane.com//blog/minimax-m27-workflows,2026-05-20 10:38:59,hacker_news
Enabling Resizable Bar on RTX 3080 Vbios via GitHub,4,3,https://github.com/danindiana/rtx3080-rebar-vbios/tree/master,2026-05-20 10:38:59,hacker_news
The Mercury logic programming system,65,15,https://github.com/Mercury-Language/mercury,2026-05-20 10:38:59,hacker_news
An OpenAI model has disproved a central conjecture in discrete geometry,136,68,https://openai.com/index/model-disproves-discrete-geometry-conjecture/,2026-05-20 19:56:11,hacker_news
"GitHub confirms breach of 3,800 repos via malicious VSCode extension",86,29,https://www.bleepingcomputer.com/news/security/github-confirms-breach-of-3-800-repos-via-malicious-vscode-extension/,2026-05-20 19:56:11,hacker_news
How fast is N tokens per second really?,164,42,https://mikeveerman.github.io/tokenspeed/,2026-05-20 19:56:11,hacker_news
Flipper One Tech Specs,40,6,https://docs.flipper.net/one/general/tech-specs,2026-05-20 19:56:12,hacker_news
Why is Inkwell stuck in review,39,13,https://www.manton.org/2026/05/19/why-is-inkwell-stuck-in.html,2026-05-20 19:56:12,hacker_news
Qwen3.7-Max: The Agent Frontier,497,192,https://qwen.ai/blog?id=qwen3.7,2026-05-20 19:56:12,hacker_news
"Sharla Boehm, the programmer whose code underpins the Internet",39,12,https://www.scientificamerican.com/article/the-programmer-whose-code-underpins-the-internet/,2026-05-20 19:56:12,hacker_news
SBCL: the ultimate assembly code breadboard (2014),85,5,https://pvk.ca/Blog/2014/03/15/sbcl-the-ultimate-assembly-code-breadboard/,2026-05-20 19:56:12,hacker_news
"Incident Report: May 19, 2026 – GCP Account Suspension",304,179,https://blog.railway.com/p/incident-report-may-19-2026-gcp-account-outage,2026-05-20 19:56:12,hacker_news
Saying Goodbye to Asm.js,243,110,https://spidermonkey.dev/blog/2026/05/20/saying-goodbye-to-asmjs.html,2026-05-20 19:56:12,hacker_news
Map of Metal,340,119,https://mapofmetal.com/,2026-05-20 19:56:13,hacker_news
Qian Xuesen: The missile genius America lost and China gained (2025),22,10,https://www.usni.org/magazines/naval-history/2025/december/missile-genius-america-lost-and-china-gained,2026-05-20 19:56:13,hacker_news
Google's AI is being manipulated. The search giant is quietly fighting back,197,144,https://www.bbc.com/future/article/20260519-google-tackles-attempts-to-hack-its-ai-results,2026-05-20 19:56:13,hacker_news
Tracking Starbucks' 'widely recyclable' cups: none ended up at recycling,87,60,https://www.beyondplastics.org/press-releases/starbucks-cups-recyclable-report,2026-05-20 19:56:13,hacker_news
Apparently Google hates us now,305,147,https://twitter.com/pokemoncentral/status/2057123807404638250,2026-05-20 19:56:13,hacker_news
"Meta blocks human rights accounts from reaching audiences in Saudi Arabia, UAE",807,343,https://www.alqst.org/ar/posts/1190,2026-05-20 19:56:13,hacker_news
Node.js 26.0.0 (Now with Temporal),39,7,https://nodejs.org/en/blog/release/v26.0.0,2026-05-20 19:56:13,hacker_news
LoRA and Weight Decay (2023),7,0,https://irhum.github.io/blog/lorawd/,2026-05-20 19:56:14,hacker_news
Formal Verification Gates for AI Coding Loops,66,10,https://reubenbrooks.dev/blog/structural-backpressure-beats-smarter-agents/,2026-05-20 19:56:14,hacker_news
Stable Audio 3,64,13,https://arxiv.org/abs/2605.17991,2026-05-20 19:56:14,hacker_news
Testing distributed systems with AI agents,59,8,https://github.com/shenli/distributed-system-testing,2026-05-20 19:56:14,hacker_news
Handling the great code forge fragmentation,24,7,https://www.alexselimov.com/posts/forge_fragmentation/,2026-05-20 19:56:14,hacker_news
Tennessee man jailed 37 days for Trump meme wins settlement after lawsuit,551,341,https://www.fire.org/news/victory-tennessee-man-jailed-37-days-trump-meme-wins-835000-settlement-after-first-amendment,2026-05-20 19:56:15,hacker_news
When Fast Fourier Transform Meets Transformer for Image Restoration (2024),63,7,https://github.com/deng-ai-lab/SFHformer,2026-05-20 19:56:15,hacker_news
Flipper One – we need your help,61,15,https://blog.flipper.net/flipper-one-we-need-your-help/,2026-05-21 11:56:57,hacker_news
Python 3.15: features that didn't make the headlines,29,3,https://blog.changs.co.uk/python-315-features-that-didnt-make-the-headlines.html,2026-05-21 11:56:57,hacker_news
Show HN: Rmux – A programmable terminal multiplexer with a Playwright-style SDK,73,43,https://github.com/helvesec/rmux,2026-05-21 11:56:57,hacker_news
Google officially announces that ads will be included in AI Mode search results,143,154,https://blog.google/products/ads-commerce/google-marketing-live-search-ads/,2026-05-21 11:56:57,hacker_news
A Girl Who Couldn't Draw Home,6,2,https://www.gailweiner.com/post/the-girl-who-couldn-t-draw-home,2026-05-21 11:56:57,hacker_news
Fender escalates legal campaign against S-style guitars,13,5,https://www.guitarworld.com/gear/electric-guitars/fender-cease-and-desist-lsl-instruments,2026-05-21 11:56:57,hacker_news
Show HN: I reverse engineered Apple's video wallpapers,321,74,https://github.com/kageroumado/phosphene,2026-05-21 11:56:58,hacker_news
Haskell Foundation 2026 Update,132,42,https://discourse.haskell.org/t/haskell-foundation-2026-update/14136,2026-05-21 11:56:58,hacker_news
"The Letter S, by Donald Knuth (1980) [pdf]",196,27,https://gwern.net/doc/design/typography/1980-knuth.pdf,2026-05-21 11:56:58,hacker_news
New features in GCC 16: Improved error messages and SARIF output,101,17,https://developers.redhat.com/articles/2026/04/28/gcc-16-improved-error-messages-sarif-output,2026-05-21 11:56:58,hacker_news
Typewise (YC S22) Is Hiring an AI Growth Engineer (Zurich or Remote),1,0,https://www.ycombinator.com/companies/typewise/jobs/HmCzfBK-ai-growth-engineer,2026-05-21 11:56:58,hacker_news
DOS Zone,271,63,https://dos.zone/,2026-05-21 11:56:58,hacker_news
No Slop Grenade,53,27,https://noslopgrenade.com/,2026-05-21 11:56:58,hacker_news
Anthropic is expanding to Colossus2. Will use GB200,223,230,https://twitter.com/nottombrown/status/2057194829986300375,2026-05-21 11:56:58,hacker_news
All the bugs they found,43,14,https://andreapivetta.com/posts/all-the-bugs-they-found.html,2026-05-21 11:56:59,hacker_news
Vivaldi 8.0,176,97,https://vivaldi.com/blog/vivaldi-on-desktop-8-0/,2026-05-21 11:56:59,hacker_news
Simulating Infinity in Conway's Game of Life with Modern C++,48,10,https://ryanjk5.github.io/posts/GOLDE/,2026-05-21 11:56:59,hacker_news
Earth is now heating up twice as fast as in previous decades,14,0,https://www.newscientist.com/article/2518362-earth-is-now-heating-up-twice-as-fast-as-in-previous-decades/,2026-05-21 11:56:59,hacker_news
Show HN: I made a tactical map-based WWII submarine simulator (public beta),66,24,https://silentshark.app/alpha/,2026-05-21 11:56:59,hacker_news
OpenAI Is Preparing to File for an IPO Soon,120,259,https://www.wsj.com/tech/ai/openai-is-preparing-to-file-for-an-ipo-very-soon-0ec95af5,2026-05-21 11:56:59,hacker_news
Archaeologists find Egyptian mummy buried with the 'Iliad',152,113,https://www.openculture.com/2026/05/archaeologists-discover-ancient-egyptian-mummy-buried-with-pages-from-homers-iliad.html,2026-05-21 11:56:59,hacker_news
Show HN: The Hanging Sculptures of the Xiaoxitian,13,3,https://funes.world/apps/the-hanging-sculptures-of-the-xiaoxitian,2026-05-21 11:56:59,hacker_news
"Amazon, Facebook, FBI have access to a private intelligence-sharing network",111,23,https://prismreports.org/2026/05/20/seattle-shield-private-companies-surveillance/,2026-05-21 18:29:16,hacker_news
Project Hail Mary – Stellar Navigation Chart,134,38,https://valhovey.github.io/gaia-mary/,2026-05-21 18:29:16,hacker_news
BBEdit 16,11,0,https://www.barebones.com/products/bbedit/bbedit16.html,2026-05-21 18:29:16,hacker_news
More than 340 local news outlets are limiting the Internet Archive's access,26,2,https://www.niemanlab.org/2026/05/more-than-340-local-news-outlets-are-limiting-the-internet-archives-access-to-their-journalism/,2026-05-21 18:29:16,hacker_news
Indexing a year of video locally on a 2021 MacBook with Gemma4-31B (50GB swap),152,55,https://blog.simbastack.com/indexed-a-year-of-video-locally/,2026-05-21 18:29:16,hacker_news
Was my $48K GPU server worth it?,58,35,https://rosmine.ai/2026/05/13/was-my-48k-gpu-worth-it/,2026-05-21 18:29:17,hacker_news
ParadeDB (YC S23) Is Hiring Distributed Systems/Platform Engineers,1,0,https://news.ycombinator.com/item?id=48225852,2026-05-21 18:29:17,hacker_news
Lost Images from the 1945 Trinity Nuclear Test Restored,196,57,https://spectrum.ieee.org/trinity-nuclear-test,2026-05-21 18:29:17,hacker_news
Launch HN: Runtime (YC P26) – Sandboxed coding agents for everyone on a team,28,7,https://www.runtm.com/,2026-05-21 18:29:17,hacker_news
We're testing new ad formats in Search and expanding our Direct Offers pilot,482,414,https://blog.google/products/ads-commerce/google-marketing-live-search-ads/,2026-05-21 18:29:17,hacker_news
Mounting Git commits as folders with NFS,47,30,https://jvns.ca/blog/2023/12/04/mounting-git-commits-as-folders-with-nfs/,2026-05-21 18:29:17,hacker_news
Waymo pauses Atlanta service as its robotaxis keep driving into floods,115,133,https://techcrunch.com/2026/05/21/waymo-pauses-atlanta-service-as-its-robotaxis-keep-driving-into-floods/,2026-05-21 18:29:17,hacker_news
Michael Keating has died,65,34,https://www.bigfinish.com/news/v/michael-keating-1947-2026,2026-05-21 18:29:17,hacker_news
Museum of Pocket Calculating Devices,21,3,https://www.calculators.de/,2026-05-21 18:29:18,hacker_news
What Is Happening to Publishing?,40,13,https://resobscura.substack.com/p/what-is-happening-to-publishing,2026-05-21 18:29:18,hacker_news
Show HN: I Dedicated 4 Years to Mastering Offline Password Cracking,136,12,https://news.ycombinator.com/item?id=48221896,2026-05-21 18:29:18,hacker_news
Chewing gum restores dad's taste and smell years after Covid,41,13,https://discover.swns.com/2026/05/chewing-gum-restores-dads-taste-and-smell-years-after-covid/,2026-05-21 18:29:18,hacker_news
We Reverse-Engineered Docker Sandbox's Undocumented MicroVM API,42,6,https://rivet.dev/blog/2026-02-04-we-reverse-engineered-docker-sandbox-undocumented-microvm-api/,2026-05-21 18:29:18,hacker_news
FatGid: FreeBSD 14.x kernel local privilege escalation,64,28,https://fatgid.io/,2026-05-21 18:29:18,hacker_news
Magic the Gathering format: Fun 40,51,47,https://fabiensanglard.net/mtg/fun/,2026-05-21 18:29:18,hacker_news
Google's Antigravity Bait and Switch,365,202,https://www.0xsid.com/blog/antigravity-bait-n-switch,2026-05-21 18:29:18,hacker_news
What Do Gödel's Incompleteness Theorems Mean?,102,45,https://www.quantamagazine.org/what-do-godels-incompleteness-theorems-truly-mean-20260518/,2026-05-21 18:29:19,hacker_news
CODA: Rewriting Transformer Blocks as GEMM-Epilogue Programs,68,7,https://arxiv.org/abs/2605.19269,2026-05-22 10:37:49,hacker_news
Slumber a TUI HTTP Client,83,30,https://slumber.lucaspickering.me,2026-05-22 10:37:49,hacker_news
The surprising story behind the first British person in space,63,17,https://www.bbc.com/culture/article/20260518-helen-sharman-the-story-behind-the-first-british-person-in-space,2026-05-22 10:37:49,hacker_news
Cleve Moler has died,114,13,https://www.mathworks.com/company/aboutus/founders/clevemoler.html,2026-05-22 10:37:50,hacker_news
The memory shortage is causing a repricing of consumer electronics,217,242,https://davidoks.blog/p/ai-is-killing-the-cheap-smartphone,2026-05-22 10:37:50,hacker_news
Blog ran on Ubuntu 16.04 for 10 years. I migrated it to FreeBSD,294,152,https://crocidb.com/post/this-blog-ran-on-ubuntu-16-04-for-10-years-i-migrated-it-to-freebsd/,2026-05-22 10:37:50,hacker_news
"Uv is fantastic, but its package management UX is a mess",214,111,https://www.loopwerk.io/articles/2026/uv-ux-mess/,2026-05-22 10:37:50,hacker_news
Using Kagi Search with Low Vision,206,69,https://veroniiiica.com/using-kagi-search-with-low-vision/,2026-05-22 10:37:50,hacker_news
The death of the brick and mortar toy store,93,94,https://brainbaking.com/post/2026/05/the-death-of-the-brick-and-mortar-toy-store/,2026-05-22 10:37:50,hacker_news
